{"schema_version":"virtualization-ai.redhat-intel.com/modernization-response/v1","correlation_id":"30100000-0000-4000-8000-000000000001","outcome":"ALLOW_REVIEW","source_state":"REHEARSAL","ai_participated":false,"reason_codes":["CONTROLS_COMPLETE"],"checks":{"identity":"PASS","network":"PASS","observability":"PASS","placement":"PASS","model":"NOT_RUN"},"advisory":{"category":"operations","summary":"Deterministic rehearsal summary; no live model participated.","rationale":"All supplied representative control observations matched the declared policy."},"model":{"id":"rehearsal-fixture","provider":"fixture","hardware":"not-observed"},"authority":"HUMAN_REVIEW_REQUIRED","evidence_id":"30100000-0000-4000-8000-000000000101"}
