{"schema_version":"virtualization-ai.redhat-intel.com/modernization-response/v1","correlation_id":"30100000-0000-4000-8000-000000000001","outcome":"ABSTAIN","source_state":"REHEARSAL","ai_participated":false,"reason_codes":["PLACEMENT_UNKNOWN"],"checks":{"identity":"PASS","network":"PASS","observability":"PASS","placement":"UNKNOWN","model":"NOT_RUN"},"authority":"HUMAN_REVIEW_REQUIRED","evidence_id":"30100000-0000-4000-8000-000000000103"}
