{"schema_version":"virtualization-ai.redhat-intel.com/modernization-response/v1","correlation_id":"30100000-0000-4000-8000-000000000001","outcome":"REFUSE","source_state":"REHEARSAL","ai_participated":false,"reason_codes":["IDENTITY_MISMATCH"],"checks":{"identity":"FAIL","network":"NOT_RUN","observability":"NOT_RUN","placement":"NOT_RUN","model":"NOT_RUN"},"authority":"HUMAN_REVIEW_REQUIRED","evidence_id":"30100000-0000-4000-8000-000000000102"}
